No.,Time,Source,Destination,Protocol,Length,Info
398,12.731181,08a80261-c5aa-41f0-ba42-5d02586628ad.local,192.168.101.171,DNS,75,Standard query 0xf999 A www.dropbox.com
399,12.732086,08a80261-c5aa-41f0-ba42-5d02586628ad.local,192.168.101.171,DNS,75,Standard query 0x1f79 HTTPS www.dropbox.com
404,12.781134,192.168.101.171,08a80261-c5aa-41f0-ba42-5d02586628ad.local,DNS,174,Standard query response 0x1f79 HTTPS www.dropbox.com CNAME www-env.dropbox-dns.com SOA dns1.p06.nsone.net
407,12.782145,192.168.101.171,08a80261-c5aa-41f0-ba42-5d02586628ad.local,DNS,125,Standard query response 0xf999 A www.dropbox.com CNAME www-env.dropbox-dns.com A 162.125.65.18
409,12.783669,08a80261-c5aa-41f0-ba42-5d02586628ad.local,www-env.dropbox-dns.com,TCP,66,52043  >  https(443) [SYN] Seq=0 Win=64240 Len=0 MSS=1460 WS=256 SACK_PERM=1
417,12.83076,www-env.dropbox-dns.com,08a80261-c5aa-41f0-ba42-5d02586628ad.local,TCP,66,"https(443)  >  52043 [SYN, ACK] Seq=0 Ack=1 Win=65535 Len=0 MSS=1360 SACK_PERM=1 WS=512"
418,12.831,08a80261-c5aa-41f0-ba42-5d02586628ad.local,www-env.dropbox-dns.com,TCP,54,52043  >  https(443) [ACK] Seq=1 Ack=1 Win=66560 Len=0
419,12.832981,08a80261-c5aa-41f0-ba42-5d02586628ad.local,www-env.dropbox-dns.com,TLSv1.2,571,Client Hello
430,12.875563,www-env.dropbox-dns.com,08a80261-c5aa-41f0-ba42-5d02586628ad.local,TCP,54,https(443)  >  52043 [ACK] Seq=1 Ack=518 Win=66560 Len=0
431,12.877811,www-env.dropbox-dns.com,08a80261-c5aa-41f0-ba42-5d02586628ad.local,TLSv1.2,2774,Server Hello
432,12.877811,www-env.dropbox-dns.com,08a80261-c5aa-41f0-ba42-5d02586628ad.local,TLSv1.2,694,"Certificate, Server Key Exchange, Server Hello Done"
433,12.878024,08a80261-c5aa-41f0-ba42-5d02586628ad.local,www-env.dropbox-dns.com,TCP,54,52043  >  https(443) [ACK] Seq=518 Ack=3361 Win=66560 Len=0
434,12.88162,08a80261-c5aa-41f0-ba42-5d02586628ad.local,www-env.dropbox-dns.com,TLSv1.2,147,"Client Key Exchange, Change Cipher Spec, Finished"
435,12.882021,08a80261-c5aa-41f0-ba42-5d02586628ad.local,www-env.dropbox-dns.com,HTTP2,153,"Magic, SETTINGS[0], WINDOW_UPDATE[0]"
436,12.882511,08a80261-c5aa-41f0-ba42-5d02586628ad.local,www-env.dropbox-dns.com,TCP,1414,52043  >  https(443) [ACK] Seq=710 Ack=3361 Win=66560 Len=1360 [TCP segment of a reassembled PDU]
437,12.882511,08a80261-c5aa-41f0-ba42-5d02586628ad.local,www-env.dropbox-dns.com,HTTP2,583,HEADERS[1]: GET /home
444,12.93133,www-env.dropbox-dns.com,08a80261-c5aa-41f0-ba42-5d02586628ad.local,TLSv1.2,312,"New Session Ticket, Change Cipher Spec, Finished"
445,12.93133,www-env.dropbox-dns.com,08a80261-c5aa-41f0-ba42-5d02586628ad.local,HTTP2,138,"SETTINGS[0], SETTINGS[0], WINDOW_UPDATE[0]"
446,12.931434,08a80261-c5aa-41f0-ba42-5d02586628ad.local,www-env.dropbox-dns.com,TCP,54,52043  >  https(443) [ACK] Seq=2599 Ack=3703 Win=66048 Len=0
447,12.933819,08a80261-c5aa-41f0-ba42-5d02586628ad.local,www-env.dropbox-dns.com,HTTP2,92,SETTINGS[0]
448,12.935798,www-env.dropbox-dns.com,08a80261-c5aa-41f0-ba42-5d02586628ad.local,TCP,54,https(443)  >  52043 [ACK] Seq=3703 Ack=2599 Win=66048 Len=0
459,13.017528,www-env.dropbox-dns.com,08a80261-c5aa-41f0-ba42-5d02586628ad.local,TCP,54,https(443)  >  52043 [ACK] Seq=3703 Ack=2637 Win=66560 Len=0
462,13.161766,www-env.dropbox-dns.com,08a80261-c5aa-41f0-ba42-5d02586628ad.local,TCP,1414,https(443)  >  52043 [ACK] Seq=3703 Ack=2637 Win=66560 Len=1360 [TCP segment of a reassembled PDU]
463,13.161766,www-env.dropbox-dns.com,08a80261-c5aa-41f0-ba42-5d02586628ad.local,HTTP2,531,"HEADERS[1]: 302 Found, DATA[1], HEADERS[1] (text/html)"
464,13.16188,08a80261-c5aa-41f0-ba42-5d02586628ad.local,www-env.dropbox-dns.com,TCP,54,52043  >  https(443) [ACK] Seq=2637 Ack=5540 Win=66560 Len=0
465,13.175445,08a80261-c5aa-41f0-ba42-5d02586628ad.local,www-env.dropbox-dns.com,HTTP2,501,HEADERS[3]: GET /login?cont=%2Fhome
469,13.237736,www-env.dropbox-dns.com,08a80261-c5aa-41f0-ba42-5d02586628ad.local,TCP,54,https(443)  >  52043 [ACK] Seq=5540 Ack=3084 Win=66560 Len=0
538,13.806995,www-env.dropbox-dns.com,08a80261-c5aa-41f0-ba42-5d02586628ad.local,TCP,1414,https(443)  >  52043 [ACK] Seq=5540 Ack=3084 Win=66560 Len=1360 [TCP segment of a reassembled PDU]
539,13.806995,www-env.dropbox-dns.com,08a80261-c5aa-41f0-ba42-5d02586628ad.local,HTTP2,855,"HEADERS[3]: 200 OK, DATA[3], DATA[3], DATA[3], DATA[3], DATA[3], DATA[3], DATA[3], DATA[3], DATA[3]"
540,13.806995,www-env.dropbox-dns.com,08a80261-c5aa-41f0-ba42-5d02586628ad.local,HTTP2,393,"DATA[3], DATA[3], DATA[3], DATA[3]"
541,13.806995,www-env.dropbox-dns.com,08a80261-c5aa-41f0-ba42-5d02586628ad.local,HTTP2,204,"DATA[3], DATA[3], DATA[3]"
542,13.806995,www-env.dropbox-dns.com,08a80261-c5aa-41f0-ba42-5d02586628ad.local,HTTP2,152,"DATA[3], DATA[3]"
543,13.806995,www-env.dropbox-dns.com,08a80261-c5aa-41f0-ba42-5d02586628ad.local,HTTP2,383,"DATA[3], DATA[3], DATA[3], DATA[3], DATA[3], DATA[3], DATA[3]"
544,13.806995,www-env.dropbox-dns.com,08a80261-c5aa-41f0-ba42-5d02586628ad.local,HTTP2,129,"DATA[3], DATA[3]"
545,13.807202,08a80261-c5aa-41f0-ba42-5d02586628ad.local,www-env.dropbox-dns.com,TCP,54,52043  >  https(443) [ACK] Seq=3084 Ack=8692 Win=66560 Len=0
551,13.901447,www-env.dropbox-dns.com,08a80261-c5aa-41f0-ba42-5d02586628ad.local,TCP,1414,https(443)  >  52043 [ACK] Seq=8692 Ack=3084 Win=66560 Len=1360 [TCP segment of a reassembled PDU]
552,13.901447,www-env.dropbox-dns.com,08a80261-c5aa-41f0-ba42-5d02586628ad.local,HTTP2,895,"DATA[3], DATA[3], DATA[3], DATA[3], DATA[3], DATA[3], DATA[3], DATA[3], DATA[3], DATA[3], DATA[3], DATA[3], DATA[3], DATA[3], DATA[3], DATA[3], DATA[3], DATA[3], DATA[3], DATA[3], DATA[3], DATA[3], DATA[3], DATA[3], DATA[3]"
553,13.901536,08a80261-c5aa-41f0-ba42-5d02586628ad.local,www-env.dropbox-dns.com,TCP,54,52043  >  https(443) [ACK] Seq=3084 Ack=10893 Win=66560 Len=0
555,13.923155,www-env.dropbox-dns.com,08a80261-c5aa-41f0-ba42-5d02586628ad.local,TCP,4134,"https(443)  >  52043 [PSH, ACK] Seq=10893 Ack=3084 Win=66560 Len=4080 [TCP segment of a reassembled PDU]"
556,13.923155,www-env.dropbox-dns.com,08a80261-c5aa-41f0-ba42-5d02586628ad.local,HTTP2,287,"DATA[3], DATA[3], DATA[3], DATA[3], DATA[3], DATA[3]"
557,13.923261,08a80261-c5aa-41f0-ba42-5d02586628ad.local,www-env.dropbox-dns.com,TCP,54,52043  >  https(443) [ACK] Seq=3084 Ack=15206 Win=66560 Len=0
559,13.939313,www-env.dropbox-dns.com,08a80261-c5aa-41f0-ba42-5d02586628ad.local,HTTP2,569,"DATA[3], DATA[3], DATA[3]"
560,13.983714,08a80261-c5aa-41f0-ba42-5d02586628ad.local,www-env.dropbox-dns.com,TCP,54,52043  >  https(443) [ACK] Seq=3084 Ack=15721 Win=66048 Len=0
562,14.004493,www-env.dropbox-dns.com,08a80261-c5aa-41f0-ba42-5d02586628ad.local,TCP,2774,"https(443)  >  52043 [PSH, ACK] Seq=15721 Ack=3084 Win=66560 Len=2720 [TCP segment of a reassembled PDU]"
563,14.004493,www-env.dropbox-dns.com,08a80261-c5aa-41f0-ba42-5d02586628ad.local,HTTP2,467,"DATA[3], DATA[3], DATA[3]"
564,14.004493,www-env.dropbox-dns.com,08a80261-c5aa-41f0-ba42-5d02586628ad.local,HTTP2,623,"DATA[3], DATA[3]"
565,14.004633,08a80261-c5aa-41f0-ba42-5d02586628ad.local,www-env.dropbox-dns.com,TCP,54,52043  >  https(443) [ACK] Seq=3084 Ack=19423 Win=66560 Len=0
566,14.005354,www-env.dropbox-dns.com,08a80261-c5aa-41f0-ba42-5d02586628ad.local,HTTP2,1104,"DATA[3], DATA[3], DATA[3]"
567,14.007773,www-env.dropbox-dns.com,08a80261-c5aa-41f0-ba42-5d02586628ad.local,TCP,1414,https(443)  >  52043 [ACK] Seq=20473 Ack=3084 Win=66560 Len=1360 [TCP segment of a reassembled PDU]
568,14.007773,www-env.dropbox-dns.com,08a80261-c5aa-41f0-ba42-5d02586628ad.local,HTTP2,387,"DATA[3], DATA[3], DATA[3]"
569,14.007915,08a80261-c5aa-41f0-ba42-5d02586628ad.local,www-env.dropbox-dns.com,TCP,54,52043  >  https(443) [ACK] Seq=3084 Ack=22166 Win=66560 Len=0
570,14.024679,www-env.dropbox-dns.com,08a80261-c5aa-41f0-ba42-5d02586628ad.local,TCP,2774,"https(443)  >  52043 [PSH, ACK] Seq=22166 Ack=3084 Win=66560 Len=2720 [TCP segment of a reassembled PDU]"
571,14.024679,www-env.dropbox-dns.com,08a80261-c5aa-41f0-ba42-5d02586628ad.local,HTTP2,418,"DATA[3], DATA[3], DATA[3], DATA[3]"
572,14.024772,08a80261-c5aa-41f0-ba42-5d02586628ad.local,www-env.dropbox-dns.com,TCP,54,52043  >  https(443) [ACK] Seq=3084 Ack=25250 Win=66560 Len=0
573,14.025473,www-env.dropbox-dns.com,08a80261-c5aa-41f0-ba42-5d02586628ad.local,HTTP2,163,"DATA[3], DATA[3], DATA[3] (text/html)"
574,14.028709,08a80261-c5aa-41f0-ba42-5d02586628ad.local,www-env.dropbox-dns.com,TCP,54,"52043  >  https(443) [FIN, ACK] Seq=3084 Ack=25359 Win=66304 Len=0"
575,14.041063,08a80261-c5aa-41f0-ba42-5d02586628ad.local,192.168.101.171,DNS,81,Standard query 0xc729 A cfl.dropboxstatic.com
576,14.041974,08a80261-c5aa-41f0-ba42-5d02586628ad.local,192.168.101.171,DNS,81,Standard query 0xd142 HTTPS cfl.dropboxstatic.com
577,14.043249,08a80261-c5aa-41f0-ba42-5d02586628ad.local,192.168.101.171,DNS,79,Standard query 0x62ca A consent.dropbox.com
578,14.04408,08a80261-c5aa-41f0-ba42-5d02586628ad.local,192.168.101.171,DNS,79,Standard query 0xa2f2 HTTPS consent.dropbox.com
591,14.068529,www-env.dropbox-dns.com,08a80261-c5aa-41f0-ba42-5d02586628ad.local,TLSv1.2,85,"Alert (Level: Warning, Description: Close Notify)"
592,14.068529,www-env.dropbox-dns.com,08a80261-c5aa-41f0-ba42-5d02586628ad.local,TCP,54,"https(443)  >  52043 [FIN, ACK] Seq=25390 Ack=3085 Win=66560 Len=0"
593,14.06866,08a80261-c5aa-41f0-ba42-5d02586628ad.local,www-env.dropbox-dns.com,TCP,54,"52043  >  https(443) [RST, ACK] Seq=3085 Ack=25390 Win=0 Len=0"
595,14.130206,192.168.101.171,08a80261-c5aa-41f0-ba42-5d02586628ad.local,DNS,167,Standard query response 0xc729 A cfl.dropboxstatic.com CNAME cfl.dropboxstatic.com.cdn.cloudflare.net A 104.16.99.29 A 104.16.100.29
596,14.130206,192.168.101.171,08a80261-c5aa-41f0-ba42-5d02586628ad.local,DNS,208,Standard query response 0xd142 HTTPS cfl.dropboxstatic.com CNAME cfl.dropboxstatic.com.cdn.cloudflare.net HTTPS
597,14.130206,192.168.101.171,08a80261-c5aa-41f0-ba42-5d02586628ad.local,DNS,143,Standard query response 0x62ca A consent.dropbox.com A 18.239.208.115 A 18.239.208.57 A 18.239.208.92 A 18.239.208.48
606,14.135276,192.168.101.171,08a80261-c5aa-41f0-ba42-5d02586628ad.local,DNS,160,Standard query response 0xa2f2 HTTPS consent.dropbox.com SOA ns-564.awsdns-06.net
608,14.140599,08a80261-c5aa-41f0-ba42-5d02586628ad.local,cfl.dropboxstatic.com.cdn.cloudflare.net,QUIC,1292,"Initial, DCID=b57f4dd4440df1d8, PKN: 1, CRYPTO, PADDING, PING, PADDING, PING, PADDING, CRYPTO, PING, PADDING, CRYPTO, PADDING, PING, CRYPTO, PING, PADDING, CRYPTO, PADDING, PING, CRYPTO"
613,14.147318,08a80261-c5aa-41f0-ba42-5d02586628ad.local,consent.dropbox.com,TCP,66,52049  >  https(443) [SYN] Seq=0 Win=64240 Len=0 MSS=1460 WS=256 SACK_PERM=1
619,14.166313,08a80261-c5aa-41f0-ba42-5d02586628ad.local,www-env.dropbox-dns.com,TCP,66,52050  >  https(443) [SYN] Seq=0 Win=64240 Len=0 MSS=1460 WS=256 SACK_PERM=1
623,14.194026,consent.dropbox.com,08a80261-c5aa-41f0-ba42-5d02586628ad.local,TCP,66,"https(443)  >  52049 [SYN, ACK] Seq=0 Ack=1 Win=65535 Len=0 MSS=1360 SACK_PERM=1 WS=512"
625,14.194026,cfl.dropboxstatic.com.cdn.cloudflare.net,08a80261-c5aa-41f0-ba42-5d02586628ad.local,QUIC,1242,Protected Payload (KP0)
626,14.194481,08a80261-c5aa-41f0-ba42-5d02586628ad.local,consent.dropbox.com,TCP,54,52049  >  https(443) [ACK] Seq=1 Ack=1 Win=66560 Len=0
628,14.195645,08a80261-c5aa-41f0-ba42-5d02586628ad.local,consent.dropbox.com,TLSv1.3,593,Client Hello
629,14.197705,cfl.dropboxstatic.com.cdn.cloudflare.net,08a80261-c5aa-41f0-ba42-5d02586628ad.local,QUIC,1242,"Handshake, SCID=01177a0a4452b851d017340a1352a15f8747f723"
630,14.197705,cfl.dropboxstatic.com.cdn.cloudflare.net,08a80261-c5aa-41f0-ba42-5d02586628ad.local,QUIC,1242,"Handshake, SCID=01177a0a4452b851d017340a1352a15f8747f723"
631,14.197705,cfl.dropboxstatic.com.cdn.cloudflare.net,08a80261-c5aa-41f0-ba42-5d02586628ad.local,QUIC,479,"Handshake, SCID=01177a0a4452b851d017340a1352a15f8747f723"
632,14.198362,08a80261-c5aa-41f0-ba42-5d02586628ad.local,cfl.dropboxstatic.com.cdn.cloudflare.net,QUIC,1292,"Initial, DCID=01177a0a4452b851d017340a1352a15f8747f723, PKN: 2, ACK, PADDING"
633,14.198673,08a80261-c5aa-41f0-ba42-5d02586628ad.local,cfl.dropboxstatic.com.cdn.cloudflare.net,QUIC,93,"Handshake, DCID=01177a0a4452b851d017340a1352a15f8747f723"
634,14.204391,08a80261-c5aa-41f0-ba42-5d02586628ad.local,cfl.dropboxstatic.com.cdn.cloudflare.net,QUIC,94,"Handshake, DCID=01177a0a4452b851d017340a1352a15f8747f723"
635,14.206824,08a80261-c5aa-41f0-ba42-5d02586628ad.local,cfl.dropboxstatic.com.cdn.cloudflare.net,QUIC,127,"Handshake, DCID=01177a0a4452b851d017340a1352a15f8747f723"
636,14.207471,08a80261-c5aa-41f0-ba42-5d02586628ad.local,cfl.dropboxstatic.com.cdn.cloudflare.net,QUIC,128,"Protected Payload (KP0), DCID=01177a0a4452b851d017340a1352a15f8747f723"
647,14.248782,www-env.dropbox-dns.com,08a80261-c5aa-41f0-ba42-5d02586628ad.local,TCP,66,"https(443)  >  52050 [SYN, ACK] Seq=0 Ack=1 Win=65535 Len=0 MSS=1360 SACK_PERM=1 WS=512"
648,14.249012,08a80261-c5aa-41f0-ba42-5d02586628ad.local,www-env.dropbox-dns.com,TCP,54,52050  >  https(443) [ACK] Seq=1 Ack=1 Win=66560 Len=0
649,14.24992,08a80261-c5aa-41f0-ba42-5d02586628ad.local,www-env.dropbox-dns.com,TLSv1.2,781,Client Hello
652,14.256635,consent.dropbox.com,08a80261-c5aa-41f0-ba42-5d02586628ad.local,TCP,54,https(443)  >  52049 [ACK] Seq=1 Ack=540 Win=67072 Len=0
653,14.256635,consent.dropbox.com,08a80261-c5aa-41f0-ba42-5d02586628ad.local,TLSv1.3,2774,"Server Hello, Change Cipher Spec, Encrypted Extensions"
654,14.256769,08a80261-c5aa-41f0-ba42-5d02586628ad.local,consent.dropbox.com,TCP,54,52049  >  https(443) [ACK] Seq=540 Ack=2721 Win=66560 Len=0
655,14.257457,cfl.dropboxstatic.com.cdn.cloudflare.net,08a80261-c5aa-41f0-ba42-5d02586628ad.local,QUIC,522,Protected Payload (KP0)
656,14.257457,cfl.dropboxstatic.com.cdn.cloudflare.net,08a80261-c5aa-41f0-ba42-5d02586628ad.local,QUIC,66,Protected Payload (KP0)
657,14.257457,cfl.dropboxstatic.com.cdn.cloudflare.net,08a80261-c5aa-41f0-ba42-5d02586628ad.local,QUIC,66,Protected Payload (KP0)
658,14.257457,cfl.dropboxstatic.com.cdn.cloudflare.net,08a80261-c5aa-41f0-ba42-5d02586628ad.local,QUIC,91,Protected Payload (KP0)
659,14.257457,consent.dropbox.com,08a80261-c5aa-41f0-ba42-5d02586628ad.local,TLSv1.3,1349,"Certificate, Certificate Verify, Finished"
660,14.257457,cfl.dropboxstatic.com.cdn.cloudflare.net,08a80261-c5aa-41f0-ba42-5d02586628ad.local,QUIC,65,Protected Payload (KP0)
662,14.263209,08a80261-c5aa-41f0-ba42-5d02586628ad.local,cfl.dropboxstatic.com.cdn.cloudflare.net,QUIC,85,"Protected Payload (KP0), DCID=01177a0a4452b851d017340a1352a15f8747f723"
663,14.263546,08a80261-c5aa-41f0-ba42-5d02586628ad.local,cfl.dropboxstatic.com.cdn.cloudflare.net,QUIC,89,"Protected Payload (KP0), DCID=01177a0a4452b851d017340a1352a15f8747f723"
664,14.268444,08a80261-c5aa-41f0-ba42-5d02586628ad.local,consent.dropbox.com,TLSv1.3,118,"Change Cipher Spec, Finished"
671,14.335364,consent.dropbox.com,08a80261-c5aa-41f0-ba42-5d02586628ad.local,TCP,54,https(443)  >  52049 [ACK] Seq=4016 Ack=604 Win=67072 Len=0
672,14.335364,consent.dropbox.com,08a80261-c5aa-41f0-ba42-5d02586628ad.local,TLSv1.3,200,New Session Ticket
673,14.335364,consent.dropbox.com,08a80261-c5aa-41f0-ba42-5d02586628ad.local,HTTP2,116,"SETTINGS[0], WINDOW_UPDATE[0]"
674,14.335364,cfl.dropboxstatic.com.cdn.cloudflare.net,08a80261-c5aa-41f0-ba42-5d02586628ad.local,QUIC,70,Protected Payload (KP0)
675,14.335364,www-env.dropbox-dns.com,08a80261-c5aa-41f0-ba42-5d02586628ad.local,TCP,54,https(443)  >  52050 [ACK] Seq=1 Ack=728 Win=66560 Len=0
676,14.335492,08a80261-c5aa-41f0-ba42-5d02586628ad.local,consent.dropbox.com,TCP,54,52049  >  https(443) [ACK] Seq=604 Ack=4224 Win=66560 Len=0
677,14.336525,www-env.dropbox-dns.com,08a80261-c5aa-41f0-ba42-5d02586628ad.local,TLSv1.2,210,"Server Hello, Change Cipher Spec, Finished"
678,14.339898,08a80261-c5aa-41f0-ba42-5d02586628ad.local,www-env.dropbox-dns.com,TLSv1.2,105,"Change Cipher Spec, Finished"
679,14.340294,08a80261-c5aa-41f0-ba42-5d02586628ad.local,www-env.dropbox-dns.com,HTTP2,153,"Magic, SETTINGS[0], WINDOW_UPDATE[0]"
680,14.340699,08a80261-c5aa-41f0-ba42-5d02586628ad.local,www-env.dropbox-dns.com,TCP,1414,52050  >  https(443) [ACK] Seq=878 Ack=157 Win=66304 Len=1360 [TCP segment of a reassembled PDU]
681,14.340699,08a80261-c5aa-41f0-ba42-5d02586628ad.local,www-env.dropbox-dns.com,HTTP2,911,HEADERS[1]: GET /page_success/end?edison_page_name=login_page_edison&path=%2Flogin&request_id=759532cc1d8d4be08d7719e01a91351d&time=1710262964
682,14.372723,08a80261-c5aa-41f0-ba42-5d02586628ad.local,cfl.dropboxstatic.com.cdn.cloudflare.net,QUIC,86,"Protected Payload (KP0), DCID=01177a0a4452b851d017340a1352a15f8747f723"
683,14.390059,www-env.dropbox-dns.com,08a80261-c5aa-41f0-ba42-5d02586628ad.local,TCP,54,https(443)  >  52050 [ACK] Seq=157 Ack=878 Win=66560 Len=0
684,14.390059,www-env.dropbox-dns.com,08a80261-c5aa-41f0-ba42-5d02586628ad.local,HTTP2,138,"SETTINGS[0], SETTINGS[0], WINDOW_UPDATE[0]"
685,14.391208,08a80261-c5aa-41f0-ba42-5d02586628ad.local,www-env.dropbox-dns.com,HTTP2,92,SETTINGS[0]
686,14.396555,www-env.dropbox-dns.com,08a80261-c5aa-41f0-ba42-5d02586628ad.local,TCP,54,https(443)  >  52050 [ACK] Seq=241 Ack=3095 Win=66560 Len=0
687,14.482768,www-env.dropbox-dns.com,08a80261-c5aa-41f0-ba42-5d02586628ad.local,TCP,54,https(443)  >  52050 [ACK] Seq=241 Ack=3133 Win=66560 Len=0
688,14.588892,www-env.dropbox-dns.com,08a80261-c5aa-41f0-ba42-5d02586628ad.local,HTTP2,358,"HEADERS[1]: 200 OK, DATA[1]"
689,14.751056,08a80261-c5aa-41f0-ba42-5d02586628ad.local,www-env.dropbox-dns.com,TCP,54,52050  >  https(443) [ACK] Seq=3133 Ack=545 Win=66048 Len=0
732,16.799662,08a80261-c5aa-41f0-ba42-5d02586628ad.local,www-env.dropbox-dns.com,TCP,1414,52050  >  https(443) [ACK] Seq=3133 Ack=545 Win=66048 Len=1360 [TCP segment of a reassembled PDU]
733,16.799662,08a80261-c5aa-41f0-ba42-5d02586628ad.local,www-env.dropbox-dns.com,HTTP2,771,HEADERS[3]: GET /pithos/privacy_consent_service
734,16.800781,08a80261-c5aa-41f0-ba42-5d02586628ad.local,www-env.dropbox-dns.com,TCP,1414,52050  >  https(443) [ACK] Seq=5210 Ack=545 Win=66048 Len=1360 [TCP segment of a reassembled PDU]
735,16.800781,08a80261-c5aa-41f0-ba42-5d02586628ad.local,www-env.dropbox-dns.com,HTTP2,774,HEADERS[5]: GET /pithos/marketing_tracker_service
743,16.855063,www-env.dropbox-dns.com,08a80261-c5aa-41f0-ba42-5d02586628ad.local,TCP,54,https(443)  >  52050 [ACK] Seq=545 Ack=4493 Win=66560 Len=0
745,16.856183,www-env.dropbox-dns.com,08a80261-c5aa-41f0-ba42-5d02586628ad.local,TCP,54,https(443)  >  52050 [ACK] Seq=545 Ack=5210 Win=66560 Len=0
746,16.856183,www-env.dropbox-dns.com,08a80261-c5aa-41f0-ba42-5d02586628ad.local,TCP,54,https(443)  >  52050 [ACK] Seq=545 Ack=7290 Win=66048 Len=0
798,17.066555,www-env.dropbox-dns.com,08a80261-c5aa-41f0-ba42-5d02586628ad.local,HTTP2,550,"HEADERS[3]: 307 Temporary Redirect, DATA[3], DATA[3] (text/html)"
861,17.251071,08a80261-c5aa-41f0-ba42-5d02586628ad.local,www-env.dropbox-dns.com,TCP,54,52050  >  https(443) [ACK] Seq=7290 Ack=1041 Win=65536 Len=0
862,17.315754,www-env.dropbox-dns.com,08a80261-c5aa-41f0-ba42-5d02586628ad.local,HTTP2,384,"HEADERS[5]: 307 Temporary Redirect, DATA[5], DATA[5] (text/html)"
863,17.360232,08a80261-c5aa-41f0-ba42-5d02586628ad.local,www-env.dropbox-dns.com,TCP,54,52050  >  https(443) [ACK] Seq=7290 Ack=1371 Win=66560 Len=0
868,17.752006,08a80261-c5aa-41f0-ba42-5d02586628ad.local,www-env.dropbox-dns.com,TCP,1414,52050  >  https(443) [ACK] Seq=7290 Ack=1371 Win=66560 Len=1360 [TCP segment of a reassembled PDU]
869,17.752006,08a80261-c5aa-41f0-ba42-5d02586628ad.local,www-env.dropbox-dns.com,HTTP2,790,HEADERS[7]: GET /pithos/host%3Aconsent.dropbox.com/privacy_consent_service
870,17.752513,08a80261-c5aa-41f0-ba42-5d02586628ad.local,www-env.dropbox-dns.com,TCP,1414,52050  >  https(443) [ACK] Seq=9386 Ack=1371 Win=66560 Len=1360 [TCP segment of a reassembled PDU]
871,17.752513,08a80261-c5aa-41f0-ba42-5d02586628ad.local,www-env.dropbox-dns.com,HTTP2,795,HEADERS[9]: GET /pithos/host%3Amarketing.dropbox.com/marketing_tracker_service
875,17.780392,08a80261-c5aa-41f0-ba42-5d02586628ad.local,www-env.dropbox-dns.com,TCP,1414,52050  >  https(443) [ACK] Seq=11487 Ack=1371 Win=66560 Len=1360 [TCP segment of a reassembled PDU]
876,17.780392,08a80261-c5aa-41f0-ba42-5d02586628ad.local,www-env.dropbox-dns.com,HTTP2,895,HEADERS[11]: POST /log/ux_analytics
877,17.780571,08a80261-c5aa-41f0-ba42-5d02586628ad.local,www-env.dropbox-dns.com,HTTP2,1022,DATA[11]
879,17.81792,www-env.dropbox-dns.com,08a80261-c5aa-41f0-ba42-5d02586628ad.local,TCP,54,https(443)  >  52050 [ACK] Seq=1371 Ack=8650 Win=66560 Len=0
880,17.81792,www-env.dropbox-dns.com,08a80261-c5aa-41f0-ba42-5d02586628ad.local,TCP,54,https(443)  >  52050 [ACK] Seq=1371 Ack=9386 Win=66560 Len=0
881,17.81792,www-env.dropbox-dns.com,08a80261-c5aa-41f0-ba42-5d02586628ad.local,TCP,54,https(443)  >  52050 [ACK] Seq=1371 Ack=10746 Win=66048 Len=0
882,17.822515,www-env.dropbox-dns.com,08a80261-c5aa-41f0-ba42-5d02586628ad.local,TCP,54,https(443)  >  52050 [ACK] Seq=1371 Ack=11487 Win=66560 Len=0
883,17.831552,www-env.dropbox-dns.com,08a80261-c5aa-41f0-ba42-5d02586628ad.local,TCP,54,https(443)  >  52050 [ACK] Seq=1371 Ack=12847 Win=66560 Len=0
884,17.831552,www-env.dropbox-dns.com,08a80261-c5aa-41f0-ba42-5d02586628ad.local,TCP,54,https(443)  >  52050 [ACK] Seq=1371 Ack=13688 Win=66560 Len=0
885,17.831552,www-env.dropbox-dns.com,08a80261-c5aa-41f0-ba42-5d02586628ad.local,TCP,54,https(443)  >  52050 [ACK] Seq=1371 Ack=14656 Win=66560 Len=0
942,18.006904,www-env.dropbox-dns.com,08a80261-c5aa-41f0-ba42-5d02586628ad.local,TCP,4134,"https(443)  >  52050 [PSH, ACK] Seq=1371 Ack=14656 Win=66560 Len=4080 [TCP segment of a reassembled PDU]"
943,18.006904,www-env.dropbox-dns.com,08a80261-c5aa-41f0-ba42-5d02586628ad.local,HTTP2,239,"HEADERS[9]: 200 OK, DATA[9], DATA[9] (text/javascript)"
944,18.007012,08a80261-c5aa-41f0-ba42-5d02586628ad.local,www-env.dropbox-dns.com,TCP,54,52050  >  https(443) [ACK] Seq=14656 Ack=5636 Win=66560 Len=0
946,18.054373,www-env.dropbox-dns.com,08a80261-c5aa-41f0-ba42-5d02586628ad.local,TCP,2774,"https(443)  >  52050 [PSH, ACK] Seq=5636 Ack=14656 Win=66560 Len=2720 [TCP segment of a reassembled PDU]"
947,18.054373,www-env.dropbox-dns.com,08a80261-c5aa-41f0-ba42-5d02586628ad.local,HTTP2,1057,"HEADERS[7]: 200 OK, DATA[7], DATA[7] (text/javascript)"
948,18.054487,08a80261-c5aa-41f0-ba42-5d02586628ad.local,www-env.dropbox-dns.com,TCP,54,52050  >  https(443) [ACK] Seq=14656 Ack=9359 Win=66560 Len=0
961,18.304481,08a80261-c5aa-41f0-ba42-5d02586628ad.local,www-env.dropbox-dns.com,TCP,1414,52050  >  https(443) [ACK] Seq=14656 Ack=9359 Win=66560 Len=1360 [TCP segment of a reassembled PDU]
962,18.304481,08a80261-c5aa-41f0-ba42-5d02586628ad.local,www-env.dropbox-dns.com,HTTP2,786,HEADERS[13]: POST /log/ux_analytics
963,18.30472,08a80261-c5aa-41f0-ba42-5d02586628ad.local,www-env.dropbox-dns.com,HTTP2,980,DATA[13]
965,18.39092,www-env.dropbox-dns.com,08a80261-c5aa-41f0-ba42-5d02586628ad.local,HTTP2,530,"HEADERS[11]: 200 OK, DATA[11]"
969,18.391625,08a80261-c5aa-41f0-ba42-5d02586628ad.local,www-env.dropbox-dns.com,TCP,1414,52050  >  https(443) [ACK] Seq=17674 Ack=9835 Win=66048 Len=1360 [TCP segment of a reassembled PDU]
970,18.391625,08a80261-c5aa-41f0-ba42-5d02586628ad.local,www-env.dropbox-dns.com,HTTP2,786,HEADERS[15]: POST /log/ux_analytics
971,18.391851,08a80261-c5aa-41f0-ba42-5d02586628ad.local,www-env.dropbox-dns.com,HTTP2,1026,DATA[15]
972,18.416763,www-env.dropbox-dns.com,08a80261-c5aa-41f0-ba42-5d02586628ad.local,TCP,54,https(443)  >  52050 [ACK] Seq=9835 Ack=16016 Win=66560 Len=0
973,18.416763,www-env.dropbox-dns.com,08a80261-c5aa-41f0-ba42-5d02586628ad.local,TCP,54,https(443)  >  52050 [ACK] Seq=9835 Ack=16748 Win=66560 Len=0
974,18.416763,www-env.dropbox-dns.com,08a80261-c5aa-41f0-ba42-5d02586628ad.local,TCP,54,https(443)  >  52050 [ACK] Seq=9835 Ack=17674 Win=66560 Len=0
983,18.468038,www-env.dropbox-dns.com,08a80261-c5aa-41f0-ba42-5d02586628ad.local,TCP,54,https(443)  >  52050 [ACK] Seq=9835 Ack=19034 Win=66560 Len=0
984,18.468038,www-env.dropbox-dns.com,08a80261-c5aa-41f0-ba42-5d02586628ad.local,TCP,54,https(443)  >  52050 [ACK] Seq=9835 Ack=19766 Win=66560 Len=0
985,18.468038,www-env.dropbox-dns.com,08a80261-c5aa-41f0-ba42-5d02586628ad.local,TCP,54,https(443)  >  52050 [ACK] Seq=9835 Ack=20738 Win=66560 Len=0
987,18.469979,08a80261-c5aa-41f0-ba42-5d02586628ad.local,www-env.dropbox-dns.com,TCP,1414,52050  >  https(443) [ACK] Seq=20738 Ack=9835 Win=66048 Len=1360 [TCP segment of a reassembled PDU]
988,18.469979,08a80261-c5aa-41f0-ba42-5d02586628ad.local,www-env.dropbox-dns.com,HTTP2,871,HEADERS[17]: POST /2/megaphone_chat/get_best_chat_campaigns
989,18.470155,08a80261-c5aa-41f0-ba42-5d02586628ad.local,www-env.dropbox-dns.com,HTTP2/JSON,144,"DATA[17], JavaScript Object Notation (application/json)"
996,18.519317,www-env.dropbox-dns.com,08a80261-c5aa-41f0-ba42-5d02586628ad.local,TCP,54,https(443)  >  52050 [ACK] Seq=9835 Ack=22098 Win=66560 Len=0
997,18.519317,www-env.dropbox-dns.com,08a80261-c5aa-41f0-ba42-5d02586628ad.local,TCP,54,https(443)  >  52050 [ACK] Seq=9835 Ack=22915 Win=66560 Len=0
998,18.519317,www-env.dropbox-dns.com,08a80261-c5aa-41f0-ba42-5d02586628ad.local,TCP,54,https(443)  >  52050 [ACK] Seq=9835 Ack=23005 Win=66560 Len=0
999,18.522215,08a80261-c5aa-41f0-ba42-5d02586628ad.local,www-env.dropbox-dns.com,TCP,1414,52050  >  https(443) [ACK] Seq=23005 Ack=9835 Win=66048 Len=1360 [TCP segment of a reassembled PDU]
1000,18.522215,08a80261-c5aa-41f0-ba42-5d02586628ad.local,www-env.dropbox-dns.com,HTTP2,786,HEADERS[19]: POST /log/ux_analytics
1001,18.522499,08a80261-c5aa-41f0-ba42-5d02586628ad.local,www-env.dropbox-dns.com,HTTP2,1009,DATA[19]
1005,18.570304,08a80261-c5aa-41f0-ba42-5d02586628ad.local,www-env.dropbox-dns.com,TCP,1414,52050  >  https(443) [ACK] Seq=26052 Ack=9835 Win=66048 Len=1360 [TCP segment of a reassembled PDU]
1006,18.570304,08a80261-c5aa-41f0-ba42-5d02586628ad.local,www-env.dropbox-dns.com,HTTP2,831,HEADERS[21]: POST /alternate_wtl_browser_performance_info
1007,18.570489,08a80261-c5aa-41f0-ba42-5d02586628ad.local,www-env.dropbox-dns.com,HTTP2,794,DATA[21] (application/x-www-form-urlencoded)
1008,18.575671,08a80261-c5aa-41f0-ba42-5d02586628ad.local,www-env.dropbox-dns.com,TCP,1414,52050  >  https(443) [ACK] Seq=28929 Ack=9835 Win=66048 Len=1360 [TCP segment of a reassembled PDU]
1009,18.575671,08a80261-c5aa-41f0-ba42-5d02586628ad.local,www-env.dropbox-dns.com,HTTP2,815,HEADERS[23]: POST /log_js_sw_data
1010,18.575955,08a80261-c5aa-41f0-ba42-5d02586628ad.local,www-env.dropbox-dns.com,HTTP2,598,DATA[23] (application/x-www-form-urlencoded)
1012,18.576775,www-env.dropbox-dns.com,08a80261-c5aa-41f0-ba42-5d02586628ad.local,TCP,54,https(443)  >  52050 [ACK] Seq=9835 Ack=24365 Win=66560 Len=0
1015,18.578259,08a80261-c5aa-41f0-ba42-5d02586628ad.local,www-env.dropbox-dns.com,TCP,1414,52050  >  https(443) [ACK] Seq=31594 Ack=9835 Win=66048 Len=1360 [TCP segment of a reassembled PDU]
1016,18.578259,08a80261-c5aa-41f0-ba42-5d02586628ad.local,www-env.dropbox-dns.com,HTTP2,815,HEADERS[25]: POST /log_js_sw_data
1017,18.578451,08a80261-c5aa-41f0-ba42-5d02586628ad.local,www-env.dropbox-dns.com,TCP,1414,52050  >  https(443) [ACK] Seq=33715 Ack=9835 Win=66048 Len=1360 [TCP segment of a reassembled PDU]
1018,18.578451,08a80261-c5aa-41f0-ba42-5d02586628ad.local,www-env.dropbox-dns.com,TCP,1414,52050  >  https(443) [ACK] Seq=35075 Ack=9835 Win=66048 Len=1360 [TCP segment of a reassembled PDU]
1019,18.578451,08a80261-c5aa-41f0-ba42-5d02586628ad.local,www-env.dropbox-dns.com,TCP,1414,52050  >  https(443) [ACK] Seq=36435 Ack=9835 Win=66048 Len=1360 [TCP segment of a reassembled PDU]
1020,18.578451,08a80261-c5aa-41f0-ba42-5d02586628ad.local,www-env.dropbox-dns.com,TCP,1414,52050  >  https(443) [ACK] Seq=37795 Ack=9835 Win=66048 Len=1360 [TCP segment of a reassembled PDU]
1021,18.578451,08a80261-c5aa-41f0-ba42-5d02586628ad.local,www-env.dropbox-dns.com,HTTP2,516,DATA[25] (application/x-www-form-urlencoded)
1022,18.583688,08a80261-c5aa-41f0-ba42-5d02586628ad.local,www-env.dropbox-dns.com,TCP,1414,52050  >  https(443) [ACK] Seq=39617 Ack=9835 Win=66048 Len=1360 [TCP segment of a reassembled PDU]
1023,18.583688,08a80261-c5aa-41f0-ba42-5d02586628ad.local,www-env.dropbox-dns.com,HTTP2,816,HEADERS[27]: POST /log_js_sw_data
1024,18.58438,08a80261-c5aa-41f0-ba42-5d02586628ad.local,www-env.dropbox-dns.com,TCP,1414,52050  >  https(443) [ACK] Seq=41739 Ack=9835 Win=66048 Len=1360 [TCP segment of a reassembled PDU]
1025,18.58438,08a80261-c5aa-41f0-ba42-5d02586628ad.local,www-env.dropbox-dns.com,TCP,1414,52050  >  https(443) [ACK] Seq=43099 Ack=9835 Win=66048 Len=1360 [TCP segment of a reassembled PDU]
1026,18.58438,08a80261-c5aa-41f0-ba42-5d02586628ad.local,www-env.dropbox-dns.com,TCP,1414,52050  >  https(443) [ACK] Seq=44459 Ack=9835 Win=66048 Len=1360 [TCP segment of a reassembled PDU]
1027,18.58438,08a80261-c5aa-41f0-ba42-5d02586628ad.local,www-env.dropbox-dns.com,TCP,1414,52050  >  https(443) [ACK] Seq=45819 Ack=9835 Win=66048 Len=1360 [TCP segment of a reassembled PDU]
1028,18.58438,08a80261-c5aa-41f0-ba42-5d02586628ad.local,www-env.dropbox-dns.com,TCP,1414,52050  >  https(443) [ACK] Seq=47179 Ack=9835 Win=66048 Len=1360 [TCP segment of a reassembled PDU]
1029,18.58438,08a80261-c5aa-41f0-ba42-5d02586628ad.local,www-env.dropbox-dns.com,TCP,1414,52050  >  https(443) [ACK] Seq=48539 Ack=9835 Win=66048 Len=1360 [TCP segment of a reassembled PDU]
1030,18.58438,08a80261-c5aa-41f0-ba42-5d02586628ad.local,www-env.dropbox-dns.com,TCP,1414,52050  >  https(443) [ACK] Seq=49899 Ack=9835 Win=66048 Len=1360 [TCP segment of a reassembled PDU]
1031,18.58438,08a80261-c5aa-41f0-ba42-5d02586628ad.local,www-env.dropbox-dns.com,TCP,1414,52050  >  https(443) [ACK] Seq=51259 Ack=9835 Win=66048 Len=1360 [TCP segment of a reassembled PDU]
1032,18.58438,08a80261-c5aa-41f0-ba42-5d02586628ad.local,www-env.dropbox-dns.com,TCP,1414,52050  >  https(443) [ACK] Seq=52619 Ack=9835 Win=66048 Len=1360 [TCP segment of a reassembled PDU]
1033,18.58438,08a80261-c5aa-41f0-ba42-5d02586628ad.local,www-env.dropbox-dns.com,TCP,1414,52050  >  https(443) [ACK] Seq=53979 Ack=9835 Win=66048 Len=1360 [TCP segment of a reassembled PDU]
1034,18.58438,08a80261-c5aa-41f0-ba42-5d02586628ad.local,www-env.dropbox-dns.com,TCP,1414,52050  >  https(443) [ACK] Seq=55339 Ack=9835 Win=66048 Len=1360 [TCP segment of a reassembled PDU]
1035,18.58438,08a80261-c5aa-41f0-ba42-5d02586628ad.local,www-env.dropbox-dns.com,TCP,1414,52050  >  https(443) [ACK] Seq=56699 Ack=9835 Win=66048 Len=1360 [TCP segment of a reassembled PDU]
1036,18.58438,08a80261-c5aa-41f0-ba42-5d02586628ad.local,www-env.dropbox-dns.com,HTTP2,147,DATA[27]
1037,18.587201,08a80261-c5aa-41f0-ba42-5d02586628ad.local,www-env.dropbox-dns.com,TCP,1414,52050  >  https(443) [ACK] Seq=58152 Ack=9835 Win=66048 Len=1360 [TCP segment of a reassembled PDU]
1038,18.587201,08a80261-c5aa-41f0-ba42-5d02586628ad.local,www-env.dropbox-dns.com,TCP,1414,52050  >  https(443) [ACK] Seq=59512 Ack=9835 Win=66048 Len=1360 [TCP segment of a reassembled PDU]
1039,18.587201,08a80261-c5aa-41f0-ba42-5d02586628ad.local,www-env.dropbox-dns.com,TCP,1414,52050  >  https(443) [ACK] Seq=60872 Ack=9835 Win=66048 Len=1360 [TCP segment of a reassembled PDU]
1040,18.606644,www-env.dropbox-dns.com,08a80261-c5aa-41f0-ba42-5d02586628ad.local,TCP,54,https(443)  >  52050 [ACK] Seq=9835 Ack=25097 Win=66560 Len=0
1041,18.606644,www-env.dropbox-dns.com,08a80261-c5aa-41f0-ba42-5d02586628ad.local,TCP,54,https(443)  >  52050 [ACK] Seq=9835 Ack=26052 Win=66560 Len=0
1042,18.606644,www-env.dropbox-dns.com,08a80261-c5aa-41f0-ba42-5d02586628ad.local,HTTP2,244,"HEADERS[13]: 200 OK, DATA[13]"
1043,18.606731,08a80261-c5aa-41f0-ba42-5d02586628ad.local,www-env.dropbox-dns.com,TCP,1414,52050  >  https(443) [ACK] Seq=62232 Ack=10025 Win=65792 Len=1360 [TCP segment of a reassembled PDU]
1044,18.606731,08a80261-c5aa-41f0-ba42-5d02586628ad.local,www-env.dropbox-dns.com,TCP,1414,52050  >  https(443) [ACK] Seq=63592 Ack=10025 Win=65792 Len=1360 [TCP segment of a reassembled PDU]
1052,18.626367,www-env.dropbox-dns.com,08a80261-c5aa-41f0-ba42-5d02586628ad.local,HTTP2/JSON,253,"HEADERS[17]: 200 OK, DATA[17], JavaScript Object Notation (application/json)"
1053,18.626492,08a80261-c5aa-41f0-ba42-5d02586628ad.local,www-env.dropbox-dns.com,TCP,1414,52050  >  https(443) [ACK] Seq=64952 Ack=10224 Win=65536 Len=1360 [TCP segment of a reassembled PDU]
1054,18.626492,08a80261-c5aa-41f0-ba42-5d02586628ad.local,www-env.dropbox-dns.com,TCP,1414,52050  >  https(443) [ACK] Seq=66312 Ack=10224 Win=65536 Len=1360 [TCP segment of a reassembled PDU]
1059,18.631541,www-env.dropbox-dns.com,08a80261-c5aa-41f0-ba42-5d02586628ad.local,TCP,54,https(443)  >  52050 [ACK] Seq=10224 Ack=28929 Win=66560 Len=0
1062,18.631541,www-env.dropbox-dns.com,08a80261-c5aa-41f0-ba42-5d02586628ad.local,TCP,54,https(443)  >  52050 [ACK] Seq=10224 Ack=31050 Win=66560 Len=0
1063,18.631541,www-env.dropbox-dns.com,08a80261-c5aa-41f0-ba42-5d02586628ad.local,TCP,54,https(443)  >  52050 [ACK] Seq=10224 Ack=32954 Win=66560 Len=0
1066,18.631931,08a80261-c5aa-41f0-ba42-5d02586628ad.local,www-env.dropbox-dns.com,TCP,1414,52050  >  https(443) [ACK] Seq=67672 Ack=10224 Win=65536 Len=1360 [TCP segment of a reassembled PDU]
1067,18.631931,08a80261-c5aa-41f0-ba42-5d02586628ad.local,www-env.dropbox-dns.com,TCP,1414,52050  >  https(443) [ACK] Seq=69032 Ack=10224 Win=65536 Len=1360 [TCP segment of a reassembled PDU]
1068,18.631931,08a80261-c5aa-41f0-ba42-5d02586628ad.local,www-env.dropbox-dns.com,HTTP2,1414,DATA[27] (application/x-www-form-urlencoded) [TCP segment of a reassembled PDU]
1069,18.631931,08a80261-c5aa-41f0-ba42-5d02586628ad.local,www-env.dropbox-dns.com,TCP,1414,52050  >  https(443) [ACK] Seq=71752 Ack=10224 Win=65536 Len=1360 [TCP segment of a reassembled PDU]
1070,18.631931,08a80261-c5aa-41f0-ba42-5d02586628ad.local,www-env.dropbox-dns.com,HTTP2,1414,HEADERS[29]: POST /alternate_wtl [TCP segment of a reassembled PDU]
1071,18.631931,08a80261-c5aa-41f0-ba42-5d02586628ad.local,www-env.dropbox-dns.com,HTTP2,1414,DATA[29] (application/x-www-form-urlencoded) [TCP segment of a reassembled PDU]
1072,18.631931,08a80261-c5aa-41f0-ba42-5d02586628ad.local,www-env.dropbox-dns.com,TCP,1414,52050  >  https(443) [ACK] Seq=75832 Ack=10224 Win=65536 Len=1360 [TCP segment of a reassembled PDU]
1073,18.631931,08a80261-c5aa-41f0-ba42-5d02586628ad.local,www-env.dropbox-dns.com,HTTP2,1414,HEADERS[31]: POST /log_js_sw_data [TCP segment of a reassembled PDU]
1074,18.631931,08a80261-c5aa-41f0-ba42-5d02586628ad.local,www-env.dropbox-dns.com,HTTP2,214,DATA[31] (application/x-www-form-urlencoded)
1078,18.685525,www-env.dropbox-dns.com,08a80261-c5aa-41f0-ba42-5d02586628ad.local,TCP,54,https(443)  >  52050 [ACK] Seq=10224 Ack=35075 Win=66560 Len=0
1079,18.685525,www-env.dropbox-dns.com,08a80261-c5aa-41f0-ba42-5d02586628ad.local,TCP,54,https(443)  >  52050 [ACK] Seq=10224 Ack=39155 Win=66560 Len=0
1080,18.685525,www-env.dropbox-dns.com,08a80261-c5aa-41f0-ba42-5d02586628ad.local,TCP,54,https(443)  >  52050 [ACK] Seq=10224 Ack=40977 Win=66048 Len=0
1081,18.706161,www-env.dropbox-dns.com,08a80261-c5aa-41f0-ba42-5d02586628ad.local,TCP,54,https(443)  >  52050 [ACK] Seq=10224 Ack=43099 Win=66560 Len=0
1082,18.706161,www-env.dropbox-dns.com,08a80261-c5aa-41f0-ba42-5d02586628ad.local,TCP,54,https(443)  >  52050 [ACK] Seq=10224 Ack=48539 Win=66560 Len=0
1084,18.706161,www-env.dropbox-dns.com,08a80261-c5aa-41f0-ba42-5d02586628ad.local,TCP,54,https(443)  >  52050 [ACK] Seq=10224 Ack=51259 Win=66560 Len=0
1085,18.706161,www-env.dropbox-dns.com,08a80261-c5aa-41f0-ba42-5d02586628ad.local,TCP,54,https(443)  >  52050 [ACK] Seq=10224 Ack=55339 Win=66560 Len=0
1087,18.706161,www-env.dropbox-dns.com,08a80261-c5aa-41f0-ba42-5d02586628ad.local,TCP,54,https(443)  >  52050 [ACK] Seq=10224 Ack=58059 Win=66560 Len=0
1089,18.706161,www-env.dropbox-dns.com,08a80261-c5aa-41f0-ba42-5d02586628ad.local,TCP,54,https(443)  >  52050 [ACK] Seq=10224 Ack=62232 Win=65024 Len=0
1090,18.706161,www-env.dropbox-dns.com,08a80261-c5aa-41f0-ba42-5d02586628ad.local,TCP,54,https(443)  >  52050 [ACK] Seq=10224 Ack=64952 Win=66048 Len=0
1091,18.706161,www-env.dropbox-dns.com,08a80261-c5aa-41f0-ba42-5d02586628ad.local,TCP,54,https(443)  >  52050 [ACK] Seq=10224 Ack=67672 Win=69120 Len=0
1092,18.706161,www-env.dropbox-dns.com,08a80261-c5aa-41f0-ba42-5d02586628ad.local,TCP,54,https(443)  >  52050 [ACK] Seq=10224 Ack=70392 Win=74752 Len=0
1093,18.706161,www-env.dropbox-dns.com,08a80261-c5aa-41f0-ba42-5d02586628ad.local,TCP,1414,https(443)  >  52050 [ACK] Seq=10224 Ack=70392 Win=74752 Len=1360 [TCP segment of a reassembled PDU]
1094,18.706161,www-env.dropbox-dns.com,08a80261-c5aa-41f0-ba42-5d02586628ad.local,HTTP2,219,"HEADERS[15]: 200 OK, DATA[15]"
1096,18.706621,08a80261-c5aa-41f0-ba42-5d02586628ad.local,www-env.dropbox-dns.com,TCP,54,52050  >  https(443) [ACK] Seq=78712 Ack=11749 Win=66560 Len=0
1104,18.770438,www-env.dropbox-dns.com,08a80261-c5aa-41f0-ba42-5d02586628ad.local,TCP,54,https(443)  >  52050 [ACK] Seq=11749 Ack=73112 Win=80384 Len=0
1107,18.795941,www-env.dropbox-dns.com,08a80261-c5aa-41f0-ba42-5d02586628ad.local,TCP,54,https(443)  >  52050 [ACK] Seq=11749 Ack=75832 Win=86016 Len=0
1108,18.795941,www-env.dropbox-dns.com,08a80261-c5aa-41f0-ba42-5d02586628ad.local,TCP,54,https(443)  >  52050 [ACK] Seq=11749 Ack=78552 Win=91648 Len=0
1111,18.79705,www-env.dropbox-dns.com,08a80261-c5aa-41f0-ba42-5d02586628ad.local,TCP,54,https(443)  >  52050 [ACK] Seq=11749 Ack=78712 Win=94208 Len=0
1114,18.79705,www-env.dropbox-dns.com,08a80261-c5aa-41f0-ba42-5d02586628ad.local,HTTP2,519,"HEADERS[19]: 200 OK, DATA[19]"
1126,18.79805,www-env.dropbox-dns.com,08a80261-c5aa-41f0-ba42-5d02586628ad.local,HTTP2,265,"HEADERS[21]: 200 OK, DATA[21]"
1129,18.798304,08a80261-c5aa-41f0-ba42-5d02586628ad.local,www-env.dropbox-dns.com,TCP,54,52050  >  https(443) [ACK] Seq=78712 Ack=12425 Win=65792 Len=0
1135,18.826057,08a80261-c5aa-41f0-ba42-5d02586628ad.local,dzfq4ouujrxm8.cloudfront.net,HTTP2,510,HEADERS[1]: GET /utag/dropbox/main/prod/utag.js
1142,18.860263,08a80261-c5aa-41f0-ba42-5d02586628ad.local,www-env.dropbox-dns.com,TCP,1414,52050  >  https(443) [ACK] Seq=78712 Ack=12425 Win=65792 Len=1360 [TCP segment of a reassembled PDU]
1143,18.860263,08a80261-c5aa-41f0-ba42-5d02586628ad.local,www-env.dropbox-dns.com,HTTP2,1248,HEADERS[33]: GET /ccpa_iframe?hide_gdpr=false&should_disable_banner=false&parent_domain_consent_cookie=%7B%22consentType%22%3A1%2C%22consentDate%22%3A%222024-03-05T13%3A15%3A05.622Z%22%2C%22expireDate%22%3A%222024-09-05T12%3A15%3A05.622Z%22%2C%22consentMonths%22%3A6%2C%22categories%22%3A%7B%22strictly%20necessary%22%3Atrue%2C%22general%20marketing%20and%20advertising%22%3Atrue%2C%22analytics%22%3Atrue%2C%22performance%20and%20functionality%22%3Atrue%2C%22social%20media%20advertising%22%3Atrue%7D%2C%22userInteracted%22%3Atrue%2C%22numDots%22%3A1%7D&parent_domain_dns_cookie=null&should_auto_open_options=false&locale_override=fr&gpc_signal=undefined
1144,18.867945,www-env.dropbox-dns.com,08a80261-c5aa-41f0-ba42-5d02586628ad.local,HTTP2,153,"HEADERS[27]: 200 OK, DATA[27]"
1157,18.888605,www-env.dropbox-dns.com,08a80261-c5aa-41f0-ba42-5d02586628ad.local,HTTP2,176,"HEADERS[23]: 200 OK, DATA[23]"
1158,18.888686,08a80261-c5aa-41f0-ba42-5d02586628ad.local,www-env.dropbox-dns.com,TCP,54,52050  >  https(443) [ACK] Seq=81266 Ack=12646 Win=65536 Len=0
1161,18.921482,www-env.dropbox-dns.com,08a80261-c5aa-41f0-ba42-5d02586628ad.local,TCP,1414,https(443)  >  52050 [ACK] Seq=12646 Ack=78712 Win=94208 Len=1360 [TCP segment of a reassembled PDU]
1162,18.921482,www-env.dropbox-dns.com,08a80261-c5aa-41f0-ba42-5d02586628ad.local,HTTP2,189,"HEADERS[31]: 200 OK, DATA[31]"
1163,18.921567,08a80261-c5aa-41f0-ba42-5d02586628ad.local,www-env.dropbox-dns.com,TCP,54,52050  >  https(443) [ACK] Seq=81266 Ack=14141 Win=66560 Len=0
